{
  "$schema": "http://json-schema.org/draft-04/schema#",
  "id": "http://justice.gov.uk/core/courts/external/apiPersonDefendant.json",
  "type": "object",
  "properties": {
    "personDetails": {
      "$ref": "http://justice.gov.uk/core/courts/external/apiPerson.json"
    },
    "bailStatus": {
      "description": "The defendant bail status for the given case",
      "$ref": "http://justice.gov.uk/core/courts/external/apiBailStatus.json"
    },
    "bailConditions": {
      "description": "Defines the conditions that have been applied to the Order of Bail, or Order of Remand into the care of the Local Authority",
      "type": "string"
    },
    "bailReasons": {
      "description": "Defines the reasons for setting bail conditions or the reasons for custody",
      "type": "string"
    },
    "custodyTimeLimit": {
      "description": "The custody time limit for the given case when the bail status is remanded-in-custody",
      "$ref": "http://justice.gov.uk/core/courts/external/apiCourtsDefinitions.json#/definitions/datePattern"
    },
    "perceivedBirthYear": {
      "$ref": "http://justice.gov.uk/core/courts/external/apiCourtsDefinitions.json#/definitions/positiveInteger"
    },
    "driverNumber": {
      "type": "string"
    },
    "driverLicenceCode": {
      "$ref": "http://justice.gov.uk/core/courts/external/apiCourtsDefinitions.json#/definitions/driverLicenseCode"
    },
    "driverLicenseIssue": {
      "description": "identifies the license issue no.",
      "type": "string"
    },
    "vehicleOperatorLicenceNumber": {
      "description": "You need an operator's licence to operate vehicles above 3.5 tonnes gross vehicle weight (gvw) that are used to carry goods (ie anything not permanently attached to the vehicle) on public roads for trade or business purposes.",
      "type": "string"
    },
    "arrestSummonsNumber": {
      "type": "string"
    },
    "employerOrganisation": {
      "$ref": "http://justice.gov.uk/core/courts/external/apiOrganisation.json"
    },
    "employerPayrollReference": {
      "type": "string"
    }
  },
  "required": [
    "personDetails"
  ],
  "additionalProperties": false
}